{
  "schema_version": 2,
  "task_id": "SDLC-GUARDRAILS-20260723",
  "generated_at": "2026-07-24T02:28:21.935653Z",
  "status": "needs-triage",
  "workflow": "needs-triage",
  "inputs": {
    "task": "Run the lifecycle guardrail changes through the Agentic SDLC workflow",
    "classification": "internal"
  },
  "matched_routes": [],
  "matched_risks": [],
  "agents": {
    "primary": [],
    "reviewers": [],
    "support": [
      "requirements-agent"
    ]
  },
  "required_quality_gates": [],
  "ignored_quality_gates": [],
  "gate_dispatch": [],
  "human_gates": [],
  "knowledge_context": {
    "status": "unavailable",
    "reason": "No portable knowledge source configured",
    "requests": []
  },
  "dispatch_fingerprint": "sha256:f5f52b878c2d6bc0c1512e3bc978d2fdd9a158606aca1f61fb45a2741291412e"
}
