{
  "schema_version": 2,
  "task_id": "phase1-tooling-debug-2026-07-23",
  "generated_at": "2026-07-24T00:20:24.646567Z",
  "status": "ready",
  "workflow": "debugging",
  "inputs": {
    "task": "Debug and reproduce the Phase 1 platform-specific tooling failure: compare pwsh -NoProfile, direct Python, and repository bin/agents wrappers; identify whether the timeout is caused by the shell host, interpreter resolution, subprocess behavior, or repository tooling. Planning-review-only; do not package, release, deploy, or modify persistent environments.",
    "classification": "internal"
  },
  "matched_routes": [
    "debugging"
  ],
  "matched_risks": [],
  "agents": {
    "primary": [
      "debugging-engineer"
    ],
    "reviewers": [
      "test-engineer"
    ],
    "support": []
  },
  "required_quality_gates": [],
  "human_gates": [],
  "knowledge_context": {
    "status": "unavailable",
    "reason": "No portable knowledge source configured",
    "requests": []
  },
  "dispatch_fingerprint": "sha256:f4c8d829b45fef7910aae4d99f9a32526b54e3a328efa5e159a036b2791797dc",
  "ignored_quality_gates": [],
  "gate_dispatch": []
}
