{
  "schema_version": 2,
  "task_id": "github-review-approvals-2026-07-24",
  "generated_at": "2026-07-24T06:00:21.772552Z",
  "status": "ready",
  "workflow": "new-service",
  "inputs": {
    "task": "Implement GitHub review backed human approvals for Agentic SDLC gates",
    "classification": "internal"
  },
  "matched_routes": [
    "build"
  ],
  "matched_risks": [],
  "agents": {
    "primary": [
      "application-engineer"
    ],
    "reviewers": [
      "code-reviewer",
      "test-engineer"
    ],
    "support": [
      "product-intent-agent",
      "requirements-agent"
    ]
  },
  "required_quality_gates": [
    {
      "id": "G1",
      "required": true,
      "reason": "Required by matched project route or workflow",
      "contributing_routes": [
        "workflow:new-service"
      ]
    },
    {
      "id": "G2",
      "required": true,
      "reason": "Required by matched project route or workflow",
      "contributing_routes": [
        "workflow:new-service"
      ]
    }
  ],
  "ignored_quality_gates": [],
  "gate_dispatch": [
    {
      "gate_id": "G1",
      "status": "required",
      "agents": [
        "product-intent-agent",
        "code-reviewer"
      ],
      "tasks": [
        "capture-intent"
      ],
      "artifacts": [
        "intent-record"
      ]
    },
    {
      "gate_id": "G2",
      "status": "required",
      "agents": [
        "requirements-agent",
        "code-reviewer"
      ],
      "tasks": [
        "baseline-requirements"
      ],
      "artifacts": [
        "requirements-baseline"
      ]
    }
  ],
  "human_gates": [],
  "knowledge_context": {
    "status": "unavailable",
    "reason": "No portable knowledge source configured",
    "requests": []
  },
  "dispatch_fingerprint": "sha256:29468608b8f151a669fe0580edbc1b526b02aeda894cfa952af2d77ed075487c"
}
